{
  "$schema": "https://json-schema.org/draft/2020-12/schema",
  "$id": "https://sprout.example/contracts/schemas/ota_release.schema.json",
  "title": "OTA release contract",
  "type": "object",
  "additionalProperties": false,
  "required": [
    "schema_version",
    "release_id",
    "firmware_version",
    "hardware_revision",
    "channel",
    "artifact_key",
    "artifact_url",
    "sha256",
    "size_bytes",
    "signature_key_id",
    "signature_algorithm",
    "signature",
    "signature_status",
    "rollback_allowed",
    "min_source_version",
    "status"
  ],
  "properties": {
    "schema_version": {
      "type": "string",
      "const": "1.0.0"
    },
    "release_id": {
      "$ref": "https://sprout.example/contracts/schemas/common.schema.json#/$defs/identifier"
    },
    "id": {
      "$ref": "https://sprout.example/contracts/schemas/common.schema.json#/$defs/identifier"
    },
    "firmware_version": {
      "$ref": "https://sprout.example/contracts/schemas/common.schema.json#/$defs/firmware_version"
    },
    "hardware_revision": {
      "type": "string",
      "pattern": "^[a-z0-9][a-z0-9_-]{0,31}$"
    },
    "channel": {
      "type": "string",
      "enum": [
        "stable",
        "canary",
        "internal"
      ]
    },
    "status": {
      "type": "string",
      "enum": [
        "draft",
        "published",
        "paused",
        "withdrawn"
      ]
    },
    "artifact_key": {
      "$ref": "https://sprout.example/contracts/schemas/common.schema.json#/$defs/object_key"
    },
    "artifact_url": {
      "type": "string",
      "format": "uri",
      "pattern": "^https://",
      "maxLength": 2048
    },
    "sha256": {
      "$ref": "https://sprout.example/contracts/schemas/common.schema.json#/$defs/sha256"
    },
    "size_bytes": {
      "type": "integer",
      "minimum": 1,
      "maximum": 16777216
    },
    "signature_key_id": {
      "type": "string",
      "pattern": "^[A-Za-z0-9._:-]{1,64}$"
    },
    "signature_algorithm": {
      "type": "string",
      "const": "ed25519"
    },
    "signature": {
      "type": "string",
      "pattern": "^[A-Za-z0-9+/]{86}==$",
      "minLength": 88,
      "maxLength": 88
    },
    "signature_status": {
      "type": "string",
      "enum": [
        "pending",
        "verified",
        "failed",
        "missing"
      ]
    },
    "signature_verified_at": {
      "$ref": "https://sprout.example/contracts/schemas/common.schema.json#/$defs/timestamp"
    },
    "rollback_allowed": {
      "type": "boolean"
    },
    "mandatory": {
      "type": "boolean"
    },
    "rollback_release_id": {
      "$ref": "https://sprout.example/contracts/schemas/common.schema.json#/$defs/identifier"
    },
    "record_version": {
      "type": "integer",
      "minimum": 1
    },
    "min_source_version": {
      "anyOf": [
        {
          "type": "string",
          "maxLength": 0
        },
        {
          "$ref": "https://sprout.example/contracts/schemas/common.schema.json#/$defs/firmware_version"
        }
      ]
    },
    "published_at": {
      "$ref": "https://sprout.example/contracts/schemas/common.schema.json#/$defs/timestamp"
    },
    "canary_percent": {
      "type": "integer",
      "minimum": 0,
      "maximum": 100
    },
    "target_type": {
      "type": "string",
      "enum": [
        "all",
        "device",
        "group"
      ]
    },
    "target_id": {
      "type": "string",
      "maxLength": 128
    },
    "release_notes": {
      "type": "string",
      "maxLength": 4000
    },
    "created_at": {
      "$ref": "https://sprout.example/contracts/schemas/common.schema.json#/$defs/timestamp"
    },
    "updated_at": {
      "$ref": "https://sprout.example/contracts/schemas/common.schema.json#/$defs/timestamp"
    }
  }
}
