{
  "schema_version": "1.0.0",
  "release_id": "ota_release_001",
  "firmware_version": "0.1.0",
  "hardware_revision": "s3_n16r8",
  "channel": "stable",
  "status": "published",
  "artifact_key": "firmware/stable/sprout-0.1.0.bin",
  "artifact_url": "https://api.clarkhub.cn/releases/0.1.0/stable/esp32_s3/firmware/sprout-0.1.0.bin",
  "sha256": "bbbbbbbbbbbbbbbbbbbbbbbbbbbbbbbbbbbbbbbbbbbbbbbbbbbbbbbbbbbbbbbb",
  "size_bytes": 4194304,
  "signature_key_id": "ota_signing_001",
  "signature_algorithm": "ed25519",
  "signature": "AAAAAAAAAAAAAAAAAAAAAAAAAAAAAAAAAAAAAAAAAAAAAAAAAAAAAAAAAAAAAAAAAAAAAAAAAAAAAAAAAAAAAA==",
  "signature_status": "verified",
  "signature_verified_at": "2026-10-01T00:00:00Z",
  "rollback_allowed": true,
  "min_source_version": "0.0.1",
  "published_at": "2026-10-01T00:00:00Z",
  "canary_percent": 10,
  "target_type": "all",
  "target_id": "",
  "release_notes": "首次设备固件发布。",
  "created_at": "2026-09-30T00:00:00Z",
  "updated_at": "2026-10-01T00:00:00Z"
}
